{
  "as_of": "2026-08-29",
  "source_run_id": "local",
  "index_level": 0.0,
  "index_return_ytd": 0.03949641440954366,
  "members": [
    {
      "ticker": "ALOS3.SA",
      "company_name": "Allos S.A.",
      "sector_b3": "Consumo N\u00e3o C\u00edclico",
      "weight": 0.008,
      "return_ytd": -0.03669160030360831,
      "contribution_to_ytd": -0.0002935328024288665
    },
    {
      "ticker": "ABEV3.SA",
      "company_name": "Ambev S.A.",
      "sector_b3": "Consumo N\u00e3o C\u00edclico",
      "weight": 0.0288,
      "return_ytd": 0.10227886949807485,
      "contribution_to_ytd": 0.002945631441544556
    },
    {
      "ticker": "ASAI3.SA",
      "company_name": "Sendas Distribuidora",
      "sector_b3": "Consumo N\u00e3o C\u00edclico",
      "weight": 0.0073,
      "return_ytd": 0.13231642881384914,
      "contribution_to_ytd": 0.0009659099303410987
    },
    {
      "ticker": "B3SA3.SA",
      "company_name": "B3 S.A. - Brasil Bolsa Balc\u00e3o",
      "sector_b3": "Financeiro",
      "weight": 0.0319,
      "return_ytd": 0.16212706578146174,
      "contribution_to_ytd": 0.005171853398428629
    },
    {
      "ticker": "BPAC11.SA",
      "company_name": "BTG Pactual",
      "sector_b3": "Financeiro",
      "weight": 0.0245,
      "return_ytd": 0.02926675507842106,
      "contribution_to_ytd": 0.000717035499421316
    },
    {
      "ticker": "BBSE3.SA",
      "company_name": "BB Seguridade",
      "sector_b3": "Financeiro",
      "weight": 0.0117,
      "return_ytd": 0.17029839282259732,
      "contribution_to_ytd": 0.001992491196024389
    },
    {
      "ticker": "BBDC4.SA",
      "company_name": "Bradesco PN",
      "sector_b3": "Financeiro",
      "weight": 0.0276,
      "return_ytd": -0.05313406070520141,
      "contribution_to_ytd": -0.001466500075463559
    },
    {
      "ticker": "BBAS3.SA",
      "company_name": "Banco do Brasil",
      "sector_b3": "Financeiro",
      "weight": 0.0353,
      "return_ytd": -0.07129987990321261,
      "contribution_to_ytd": -0.0025168857605834052
    },
    {
      "ticker": "BRKM5.SA",
      "company_name": "Braskem",
      "sector_b3": "Materiais B\u00e1sicos",
      "weight": 0.0042,
      "return_ytd": -0.6078577650349548,
      "contribution_to_ytd": -0.00255300261314681
    },
    {
      "ticker": "CMIG4.SA",
      "company_name": "Cemig PN",
      "sector_b3": "Utilidade P\u00fablica",
      "weight": 0.0091,
      "return_ytd": -0.032687735410429596,
      "contribution_to_ytd": -0.00029745839223490933
    },
    {
      "ticker": "CSAN3.SA",
      "company_name": "Cosan S.A.",
      "sector_b3": "Petr\u00f3leo G\u00e1s e Biocombust\u00edveis",
      "weight": 0.007,
      "return_ytd": -0.34719618970198574,
      "contribution_to_ytd": -0.0024303733279139
    },
    {
      "ticker": "CSNA3.SA",
      "company_name": "Companhia Sider\u00fargica Nacional",
      "sector_b3": "Materiais B\u00e1sicos",
      "weight": 0.0048,
      "return_ytd": -0.4824951165273751,
      "contribution_to_ytd": -0.0023159765593314
    },
    {
      "ticker": "CYRE3.SA",
      "company_name": "Cyrela Realty",
      "sector_b3": "Consumo C\u00edclico",
      "weight": 0.0049,
      "return_ytd": -0.006700186415441795,
      "contribution_to_ytd": -3.2830913435664796e-05
    },
    {
      "ticker": "ENGI11.SA",
      "company_name": "Energisa",
      "sector_b3": "Utilidade P\u00fablica",
      "weight": 0.0089,
      "return_ytd": 0.008669043544786367,
      "contribution_to_ytd": 7.715448754859866e-05
    },
    {
      "ticker": "EQTL3.SA",
      "company_name": "Equatorial Energia",
      "sector_b3": "Utilidade P\u00fablica",
      "weight": 0.0149,
      "return_ytd": -0.04240070369722098,
      "contribution_to_ytd": -0.0006317704850885926
    },
    {
      "ticker": "GGBR4.SA",
      "company_name": "Gerdau PN",
      "sector_b3": "Materiais B\u00e1sicos",
      "weight": 0.0142,
      "return_ytd": 0.1689019122439289,
      "contribution_to_ytd": 0.0023984071538637906
    },
    {
      "ticker": "HAPV3.SA",
      "company_name": "Hapvida",
      "sector_b3": "Sa\u00fade",
      "weight": 0.0078,
      "return_ytd": -0.7988129928213811,
      "contribution_to_ytd": -0.006230741344006772
    },
    {
      "ticker": "HYPE3.SA",
      "company_name": "Hypera",
      "sector_b3": "Sa\u00fade",
      "weight": 0.005,
      "return_ytd": -0.08201989264460281,
      "contribution_to_ytd": -0.00041009946322301407
    },
    {
      "ticker": "ITSA4.SA",
      "company_name": "Ita\u00fasa PN",
      "sector_b3": "Financeiro",
      "weight": 0.0226,
      "return_ytd": 0.10935901031388283,
      "contribution_to_ytd": 0.0024715136330937517
    },
    {
      "ticker": "ITUB4.SA",
      "company_name": "Ita\u00fa Unibanco PN",
      "sector_b3": "Financeiro",
      "weight": 0.067,
      "return_ytd": 0.00857691601525341,
      "contribution_to_ytd": 0.0005746533730219785
    },
    {
      "ticker": "KLBN11.SA",
      "company_name": "Klabin",
      "sector_b3": "Materiais B\u00e1sicos",
      "weight": 0.0094,
      "return_ytd": -0.015839783581183015,
      "contribution_to_ytd": -0.00014889396566312033
    },
    {
      "ticker": "LREN3.SA",
      "company_name": "Lojas Renner",
      "sector_b3": "Consumo C\u00edclico",
      "weight": 0.0094,
      "return_ytd": -0.21577641810299497,
      "contribution_to_ytd": -0.002028298330168153
    },
    {
      "ticker": "MGLU3.SA",
      "company_name": "Magazine Luiza",
      "sector_b3": "Consumo C\u00edclico",
      "weight": 0.0024,
      "return_ytd": -0.5918801691682163,
      "contribution_to_ytd": -0.001420512406003719
    },
    {
      "ticker": "MULT3.SA",
      "company_name": "Multiplan",
      "sector_b3": "Financeiro",
      "weight": 0.0064,
      "return_ytd": 0.02331010272525904,
      "contribution_to_ytd": 0.00014918465744165785
    },
    {
      "ticker": "PETR3.SA",
      "company_name": "Petrobras ON",
      "sector_b3": "Petr\u00f3leo G\u00e1s e Biocombust\u00edveis",
      "weight": 0.0387,
      "return_ytd": 0.39392530306057905,
      "contribution_to_ytd": 0.015244909228444408
    },
    {
      "ticker": "PETR4.SA",
      "company_name": "Petrobras PN",
      "sector_b3": "Petr\u00f3leo G\u00e1s e Biocombust\u00edveis",
      "weight": 0.0673,
      "return_ytd": 0.3431850259165706,
      "contribution_to_ytd": 0.0230963522441852
    },
    {
      "ticker": "PRIO3.SA",
      "company_name": "PetroRio",
      "sector_b3": "Petr\u00f3leo G\u00e1s e Biocombust\u00edveis",
      "weight": 0.0107,
      "return_ytd": 0.3804092857782191,
      "contribution_to_ytd": 0.004070379357826944
    },
    {
      "ticker": "RADL3.SA",
      "company_name": "Raia Drogasil",
      "sector_b3": "Sa\u00fade",
      "weight": 0.014,
      "return_ytd": -0.19583741022785056,
      "contribution_to_ytd": -0.0027417237431899078
    },
    {
      "ticker": "RDOR3.SA",
      "company_name": "Rede D'Or S\u00e3o Luiz",
      "sector_b3": "Sa\u00fade",
      "weight": 0.0136,
      "return_ytd": -0.13223943846631345,
      "contribution_to_ytd": -0.0017984563631418629
    },
    {
      "ticker": "RENT3.SA",
      "company_name": "Localiza",
      "sector_b3": "Consumo C\u00edclico",
      "weight": 0.015,
      "return_ytd": -0.2026882938770184,
      "contribution_to_ytd": -0.0030403244081552757
    },
    {
      "ticker": "SANB11.SA",
      "company_name": "Santander Brasil",
      "sector_b3": "Financeiro",
      "weight": 0.0084,
      "return_ytd": -0.09712581602027721,
      "contribution_to_ytd": -0.0008158568545703286
    },
    {
      "ticker": "SBSP3.SA",
      "company_name": "Sabesp",
      "sector_b3": "Utilidade P\u00fablica",
      "weight": 0.0182,
      "return_ytd": -0.0522807152166576,
      "contribution_to_ytd": -0.0009515090169431683
    },
    {
      "ticker": "TAEE11.SA",
      "company_name": "Taesa",
      "sector_b3": "Utilidade P\u00fablica",
      "weight": 0.0044,
      "return_ytd": -0.04594016053885255,
      "contribution_to_ytd": -0.0002021367063709512
    },
    {
      "ticker": "TOTS3.SA",
      "company_name": "Totvs",
      "sector_b3": "Tecnologia da Informa\u00e7\u00e3o",
      "weight": 0.0103,
      "return_ytd": -0.16150446324917223,
      "contribution_to_ytd": -0.001663495971466474
    },
    {
      "ticker": "UGPA3.SA",
      "company_name": "Ultrapar",
      "sector_b3": "Petr\u00f3leo G\u00e1s e Biocombust\u00edveis",
      "weight": 0.008,
      "return_ytd": 0.458552985587183,
      "contribution_to_ytd": 0.003668423884697464
    },
    {
      "ticker": "USIM5.SA",
      "company_name": "Usiminas PNA",
      "sector_b3": "Materiais B\u00e1sicos",
      "weight": 0.0033,
      "return_ytd": 0.18148509410015998,
      "contribution_to_ytd": 0.0005989008105305279
    },
    {
      "ticker": "VALE3.SA",
      "company_name": "Vale",
      "sector_b3": "Materiais B\u00e1sicos",
      "weight": 0.0908,
      "return_ytd": 0.08890931655963406,
      "contribution_to_ytd": 0.008072965943614773
    },
    {
      "ticker": "WEGE3.SA",
      "company_name": "WEG",
      "sector_b3": "Bens Industriais",
      "weight": 0.0297,
      "return_ytd": 0.04279554451328068,
      "contribution_to_ytd": 0.0012710276720444363
    }
  ]
}